{
  "schema_version": "2.0",
  "request_id": "a1b2c3d4-e5f6-7890-abcd-ef1234567890",
  "source_revision": "sha256:e3b0c44298fc1c149afbf4c8996fb92427ae41e4649b934ca495991b7852b855",
  "profile": {
    "id": "architecture.korean",
    "version": "2.0.0",
    "workflow_mode": "REFERENCE_FRAME_RELAY"
  },
  "subject": {
    "topic": "hanok",
    "genre": "architecture",
    "subtype": "hanok",
    "topic_label": "Korean Architecture: Hanok"
  },
  "style_bible": {
    "identity_lock": "macro cinematography, 100mm lens, extreme close-up, soft focus pulls, Korean traditional wooden architecture, hanok, tiled roof, wooden beams, stone foundation",
    "materials": {
      "primary": ["wood", "clay tiles (giwa)", "stone foundation", "hanji paper windows", "ondol floor stones"],
      "secondary": ["moss", "lichen", "seasonal foliage"],
      "tools": ["miniature chisel", "tiny trowel", "brush", "magnifying glass", "wooden mallet"]
    },
    "camera": {
      "lens": "100mm macro",
      "angle": "extreme_closeup",
      "movement": "soft_focus_pull",
      "distance": "extreme_macro"
    },
    "lighting": {
      "key": "soft directional morning light",
      "fill": "ambient skylight",
      "mood": "warm_cinematic",
      "consistency": "locked"
    },
    "color_palette": {
      "primary": ["warm wood tones", "terracotta", "stone gray"],
      "accent": ["dancheong red/green/blue", "gold leaf"],
      "background": "soft blurred nature",
      "tone": "warm_natural"
    },
    "workspace": {
      "surface": "dark wooden workbench",
      "environment": "traditional carpentry workshop",
      "clutter_rule": "organized_chaos"
    },
    "hands_rule": "giant_hands_only",
    "motion_rule": "stop_motion_assembly",
    "negative_prompt_base": "text, subtitle, caption, watermark, logo, burnt-in text, overlay text, bad anatomy, deformed hands, blurry, miniature people, tiny workers, shaky camera, camera shake, modern buildings, steel, concrete, glass curtain wall, neon lights, electricity"
  },
  "scenes": [
    {
      "id": 1,
      "name": "Foundation & Framework",
      "start_state": "Empty workbench with materials",
      "ordered_actions": ["Lay foundation stones", "Place base timbers", "Erect vertical posts", "Secure horizontal beams"],
      "end_state": "Complete timber framework on stone foundation",
      "local_first_frame_prompt": "Ultra-realistic 8K HDR macro cinematography, 100mm macro lens, extreme close-up, soft focus pulls. Giant human hands only, no miniature people, no tiny workers, no small figures. Foundation stones and timber framework of a Hanok (Traditional Korean House) on a dark wooden workbench, traditional carpentry workshop, warm morning light. Individual wooden beams, clay tiles, stone blocks laid out separately, not yet assembled. Miniature chisel, trowel, brush, magnifying glass, wooden mallet visible. Scene: Master Image.",
      "local_video_prompt": "Ultra-realistic 8K HDR macro cinematography, 100mm macro lens, extreme close-up, soft focus pulls. Giant human hands only, no miniature people, no tiny workers, no small figures. Identical lighting, camera angle, workbench, and workshop throughout. Giant hands lay foundation stones with miniature trowel, mortar visible between joints. Hands place base timbers (sill plates) on stone foundation, checking alignment. Vertical posts erected one by one, mortise-and-tenon joints fitted with wooden mallet. Horizontal beams (girders) lowered onto posts, joints secured. Final state: Complete timber framework standing on stone foundation, ready for roof structure. Identical workshop, lighting, tools, and camera maintained. No voices, no music, only satisfying ASMR sounds (wood joinery, stone setting, brush strokes). Negative Prompt: text, subtitle, caption, watermark, logo, burnt-in text, overlay text, bad anatomy, deformed hands, blurry, miniature people, tiny workers, shaky camera, camera shake, modern buildings, steel, concrete, glass curtain wall, neon lights, electricity."
    },
    {
      "id": 2,
      "name": "Roof Structure",
      "start_state": "Framework ready for roof",
      "ordered_actions": ["Position rafters", "Place ridge beam", "Add purlins", "Lay clay tiles"],
      "end_state": "Complete tiled roof with curved eaves",
      "local_first_frame_prompt": "",
      "local_video_prompt": "Ultra-realistic 8K HDR macro cinematography, 100mm macro lens, extreme close-up, soft focus pulls. Giant human hands only, no miniature people, no tiny workers, no small figures. Identical lighting, camera angle, workbench, and workshop throughout. Hands lift and position rafters onto beam framework, precise angle cuts visible. Ridge beam placed, rafters secured with traditional joinery. Purlins added horizontally, creating roof grid. Clay tiles laid from bottom edge upward, overlapping perfectly. Final state: Complete tiled roof with curved eaves, ridge ornaments in place. Identical workshop, lighting, tools, and camera maintained. No voices, no music, only satisfying ASMR sounds (wood joinery, stone setting, brush strokes). Negative Prompt: text, subtitle, caption, watermark, logo, burnt-in text, overlay text, bad anatomy, deformed hands, blurry, miniature people, tiny workers, shaky camera, camera shake, modern buildings, steel, concrete, glass curtain wall, neon lights, electricity."
    },
    {
      "id": 3,
      "name": "Walls, Details & Completion",
      "start_state": "Roof complete",
      "ordered_actions": ["Fit wall panels", "Install hanji windows", "Paint dancheong", "Place courtyard stones"],
      "end_state": "Fully assembled hanok with tiled roof, paper windows, painted details, stone courtyard",
      "local_first_frame_prompt": "",
      "local_video_prompt": "Ultra-realistic 8K HDR macro cinematography, 100mm macro lens, extreme close-up, soft focus pulls. Giant human hands only, no miniature people, no tiny workers, no small figures. Identical lighting, camera angle, workbench, and workshop throughout. Wall panels (wattle-and-daub or wooden) fitted between posts. Hanji paper windows installed in lattice frames. Dancheong patterns painted on exposed beams and eaves. Stone steps and courtyard stones placed. Final state: Fully assembled hanok with tiled roof, paper windows, painted details, stone courtyard. Identical workshop, lighting, tools, and camera maintained. No voices, no music, only satisfying ASMR sounds (wood joinery, stone setting, brush strokes). Negative Prompt: text, subtitle, caption, watermark, logo, burnt-in text, overlay text, bad anatomy, deformed hands, blurry, miniature people, tiny workers, shaky camera, camera shake, modern buildings, steel, concrete, glass curtain wall, neon lights, electricity."
    }
  ],
  "mutable_fields": ["scenes.*.first_frame_prompt", "scenes.*.video_prompt"],
  "immutable_rules": [
    "Scene 1 must have first_frame_prompt; Scenes 2+ must have empty first_frame_prompt",
    "StyleBible.identity_lock must appear in every prompt",
    "No miniature people in any prompt",
    "Lighting, camera angle, workbench must remain identical across scenes",
    "Negative prompt base must not be altered",
    "Ordered actions must follow logical construction sequence"
  ]
}